{
  "schema_version": "1.0.0",
  "catalog_version": "2.2.0",
  "held_out_policy": "These E-01 through E-33 fixtures are known regressions, not held-out evaluations. Held-out variants must be generated by an independent evaluator only after skill/content freeze and recorded separately.",
  "coverage_map": {
    "explicit_trigger": ["E-01"],
    "implicit_equivalent": ["E-24"],
    "incomplete_input": ["E-16"],
    "negative_control": ["E-23", "E-33"],
    "unsupported_action": ["E-06", "E-18"]
  },
  "cases": [
    {
      "case_id": "E-01",
      "version": "1.0.0",
      "title": "Perfect-score false reassurance",
      "rationale": "A polished artifact must not receive a top importance/readiness result when its motivating problem and consequence arrive only after dense detail.",
      "criticality": "CORE_REGRESSION",
      "requirement_ids": ["UR-01", "UR-02"],
      "route": {"operation": "DIAGNOSE", "depth": "FULL", "urgency": "STANDARD", "document_type": "RESEARCH_STATEMENT"},
      "prompt": "Run GatedSprint Phase 1 on the attached research statement. Diagnose it only; do not edit the source.",
      "prelude": [],
      "artifacts": [
        {"artifact_id": "E01-DRAFT", "path": "fixtures/scenarios.json", "selector": "/E-01/current_draft", "media_type": "application/json", "source_role": "CURRENT_DRAFT", "sha256": "894995085e7c142540f2594533d8b960dbdaf1fd06d75a7420ec6201f7e5063b", "content_authority": "AUTHORITATIVE", "layout_authority": "NONE", "editable_target": false, "version_equivalence": {"status": "NOT_APPLICABLE", "basis": "Single synthetic current draft."}}
      ],
      "authority": {"latest_designation": "The attached draft is current for content; no layout artifact is supplied.", "current_source_artifact_ids": ["E01-DRAFT"], "content_authority_artifact_ids": ["E01-DRAFT"], "layout_authority_artifact_ids": [], "editable_target_artifact_ids": [], "conflict_rule": "Use only the current draft and do not infer layout authority."},
      "starting_state": {"workflow_status": "UNSTARTED", "source_revision": "E01-current", "source_fingerprint": "894995085e7c142540f2594533d8b960dbdaf1fd06d75a7420ec6201f7e5063b", "decisions": [], "locks": []},
      "expected": {"findings": {"motivation_first_gate": "FAIL", "maximum_importance_score": 4}, "states": {"readiness": "NOT_READY"}, "actions": ["PROPOSE_REORDER_BEFORE_LINE_POLISH"]},
      "required_behavior": [
        {"behavior_id": "E01-R1", "description": "Fail the opening-surface motivation/significance retrieval gate and cap the relevant score below 5.", "evidence_target": "STRUCTURED_OUTPUT"},
        {"behavior_id": "E01-R2", "description": "Prioritize reordering or hierarchy before sentence-level polishing.", "evidence_target": "FINAL_RESPONSE"}
      ],
      "forbidden_behavior": [
        {"behavior_id": "E01-F1", "description": "Declare the document ready or assign a 5/5 importance result despite the failed opening retrieval.", "action_codes": ["DECLARE_READY", "RATE_IMPORTANCE_5"], "zero_tolerance": true},
        {"behavior_id": "E01-F2", "description": "Recommend line polish as the sufficient remedy.", "action_codes": ["LINE_POLISH_ONLY"], "zero_tolerance": true}
      ],
      "deterministic_checks": [
        {"check_id": "E01-D1", "type": "STRUCTURED_EQUALS", "path": "structured_output.findings.motivation_first_gate", "expected": "FAIL"},
        {"check_id": "E01-D2", "type": "STRUCTURED_EQUALS", "path": "structured_output.states.readiness", "expected": "NOT_READY"},
        {"check_id": "E01-D3", "type": "STRUCTURED_CONTAINS", "path": "structured_output.actions", "expected": "PROPOSE_REORDER_BEFORE_LINE_POLISH"},
        {"check_id": "E01-D4", "type": "ACTION_ABSENT", "expected": "RATE_IMPORTANCE_5"},
        {"check_id": "E01-D5", "type": "SOURCE_HASH_UNCHANGED", "artifact_id": "E01-DRAFT", "expected": true}
      ],
      "graders": {
        "deterministic": {"grader_id": "E01-DG", "check_ids": ["E01-D1", "E01-D2", "E01-D3", "E01-D4", "E01-D5"]},
        "qualitative": {"grader_id": "E01-QG", "minimum_result": "PASS", "rubric": [{"criterion_id": "E01-Q1", "description": "The response cites the technical-first opening and late significance as the reason for the gate failure, then proposes a hierarchy-level remedy before polish.", "required": true}], "evidence_must_cite": ["an exact opening-detail excerpt from the fixture", "the response passage that prioritizes reordering or hierarchy"]}
      },
      "required_one_shot": true,
      "held_out_forward_evaluation": false
    },
    {
      "case_id": "E-02",
      "version": "1.0.0",
      "title": "Per-unit motivation missing",
      "rationale": "Clear overall significance does not excuse major units that ask the reader to process methods before knowing each unit's question and value.",
      "criticality": "CORE_REGRESSION",
      "requirement_ids": ["UR-02"],
      "route": {"operation": "DIAGNOSE", "depth": "FULL", "urgency": "STANDARD", "document_type": "RESEARCH_STATEMENT"},
      "prompt": "Run a full GatedSprint Phase 1 diagnostic on this current research statement. Stop for decisions and do not rewrite it.",
      "prelude": [],
      "artifacts": [
        {"artifact_id": "E02-DRAFT", "path": "fixtures/scenarios.json", "selector": "/E-02/current_draft", "media_type": "application/json", "source_role": "CURRENT_DRAFT", "sha256": "894995085e7c142540f2594533d8b960dbdaf1fd06d75a7420ec6201f7e5063b", "content_authority": "AUTHORITATIVE", "layout_authority": "NONE", "editable_target": false, "version_equivalence": {"status": "NOT_APPLICABLE", "basis": "Single synthetic current draft."}}
      ],
      "authority": {"latest_designation": "This research statement is the current draft.", "current_source_artifact_ids": ["E02-DRAFT"], "content_authority_artifact_ids": ["E02-DRAFT"], "layout_authority_artifact_ids": [], "editable_target_artifact_ids": [], "conflict_rule": "Evaluate the current draft only."},
      "starting_state": {"workflow_status": "UNSTARTED", "source_revision": "E02-current", "source_fingerprint": "894995085e7c142540f2594533d8b960dbdaf1fd06d75a7420ec6201f7e5063b", "decisions": [], "locks": []},
      "expected": {"findings": {"document_opening_gate": "PASS", "aim_1_opening_gate": "FAIL", "aim_2_opening_gate": "FAIL"}, "states": {"readiness": "NOT_READY"}, "actions": ["PROPOSE_SECTION_SPECIFIC_OPENINGS"]},
      "required_behavior": [
        {"behavior_id": "E02-R1", "description": "Test and flag both Aim openings separately while recognizing that the overall opening passes.", "evidence_target": "STRUCTURED_OUTPUT"},
        {"behavior_id": "E02-R2", "description": "Recommend distinct, section-specific motivation/value framing rather than a repeated template.", "evidence_target": "FINAL_RESPONSE"}
      ],
      "forbidden_behavior": [
        {"behavior_id": "E02-F1", "description": "Pass the per-unit gate solely because the document-level significance is clear.", "action_codes": ["PASS_AIMS_FROM_DOCUMENT_OPENING"], "zero_tolerance": true},
        {"behavior_id": "E02-F2", "description": "Insert the same generic significance sentence into every Aim.", "action_codes": ["FORMULAIC_AIM_OPENINGS"], "zero_tolerance": true}
      ],
      "deterministic_checks": [
        {"check_id": "E02-D1", "type": "STRUCTURED_EQUALS", "path": "structured_output.findings.aim_1_opening_gate", "expected": "FAIL"},
        {"check_id": "E02-D2", "type": "STRUCTURED_EQUALS", "path": "structured_output.findings.aim_2_opening_gate", "expected": "FAIL"},
        {"check_id": "E02-D3", "type": "STRUCTURED_CONTAINS", "path": "structured_output.actions", "expected": "PROPOSE_SECTION_SPECIFIC_OPENINGS"},
        {"check_id": "E02-D4", "type": "ACTION_ABSENT", "expected": "FORMULAIC_AIM_OPENINGS"}
      ],
      "graders": {
        "deterministic": {"grader_id": "E02-DG", "check_ids": ["E02-D1", "E02-D2", "E02-D3", "E02-D4"]},
        "qualitative": {"grader_id": "E02-QG", "minimum_result": "PASS", "rubric": [{"criterion_id": "E02-Q1", "description": "The response reconstructs what is missing from each Aim opening and proposes non-identical remedies tied to the Aim's own scientific function.", "required": true}], "evidence_must_cite": ["both method-first Aim openings", "both section-specific recommendations"]}
      },
      "required_one_shot": true,
      "held_out_forward_evaluation": false
    },
    {
      "case_id": "E-03",
      "version": "1.0.0",
      "title": "Generic significance accumulation",
      "rationale": "A list of plausible applications can increase words while leaving the primary scientific value invisible.",
      "criticality": "EXTENDED",
      "requirement_ids": ["UR-02"],
      "route": {"operation": "DIAGNOSE", "depth": "FOCUSED", "urgency": "STANDARD", "document_type": "RESEARCH_STATEMENT"},
      "prompt": "Use GatedSprint to diagnose only the significance paragraph in this current draft. Do not edit the source.",
      "prelude": [],
      "artifacts": [
        {"artifact_id": "E03-DRAFT", "path": "fixtures/scenarios.json", "selector": "/E-03/current_draft", "media_type": "application/json", "source_role": "CURRENT_DRAFT", "sha256": "894995085e7c142540f2594533d8b960dbdaf1fd06d75a7420ec6201f7e5063b", "content_authority": "AUTHORITATIVE", "layout_authority": "NONE", "editable_target": false, "version_equivalence": {"status": "NOT_APPLICABLE", "basis": "Single synthetic paragraph."}}
      ],
      "authority": {"latest_designation": "The paragraph is the bounded current source.", "current_source_artifact_ids": ["E03-DRAFT"], "content_authority_artifact_ids": ["E03-DRAFT"], "layout_authority_artifact_ids": [], "editable_target_artifact_ids": [], "conflict_rule": "Do not broaden beyond the supplied paragraph."},
      "starting_state": {"workflow_status": "UNSTARTED", "source_revision": "E03-current", "source_fingerprint": "894995085e7c142540f2594533d8b960dbdaf1fd06d75a7420ec6201f7e5063b", "decisions": [], "locks": []},